{"schema_version":"2.0.0","task_id":"bootstrap-superdesktop-workspace/2.4.1","subcheck":"engine","status":"passed","artifact":"evidence/artifacts/2.4/contract-verifier.md","artifact_sha256":"A8197C89ECC1E334531EEDC0A991E6F99CAF4FCE00B4DF5A6E3026659CE34BD1","capability_id":"superdesktop-evidence-governance","requirement_id":"contract-manifest-verification","scenario_id":"canonical-contract-inputs","gates":["G-TRACE","G-ARCH"],"reviewer":"Workspace/Build owner","recorded_at":"2026-08-14T07:00:00+08:00","procedure":"engine","expected":"valid","actual":"valid"}
